location_id,name,distance,bearing,address_obj.street1,address_obj.city,address_obj.country,address_obj.postalcode,address_obj.address_string,address_obj.street2,address_obj.state
23654441,Glam Caffe,0.4152738488411994,south,Rua Americo Diniz 111 Casas Novas,Coimbra,Portugal,3045-138,"Rua Americo Diniz 111 Casas Novas, Coimbra 3045-138 Portugal",,
13124988,Just Be,0.32846147059650677,east,Avenida Sao Sebastiao 9,Evora,Portugal,7000-767,"Avenida Sao Sebastiao 9, Evora 7000-767 Portugal",,
7224821,Igreja de Nossa Senhora da Lapa,0.05738548677532225,north,Campo da Restauracao,Vila Vicosa,Portugal,7150-000,"Campo da Restauracao, Vila Vicosa 7150-000 Portugal",,
7142467,Oficina da Formiga Ceramica,0.38543677531537224,southwest,Rua da Coutada 77,Ilhavo,Portugal,3830-134,"Rua da Coutada 77, Ilhavo 3830-134 Portugal",,
20999967,Memories Night Club,1.0370434412018548,north,Travessa do Monte do Paco 56,Esgueira,Portugal,3800-036,"Travessa do Monte do Paco 56, Esgueira 3800-036 Portugal",,
17568170,Geres Adventure,1.076784826331957,southwest,Avenida das Pontes N 446,Rio Caldo,Portugal,4845-024,"Avenida das Pontes N 446, Rio Caldo 4845-024 Portugal",,
7140311,Chafariz das Bravas,0.17112764710526715,northwest,Avenida Tulio Espanca,Evora,Portugal,7000-768,"Avenida Tulio Espanca, Evora 7000-768 Portugal",,
15013442,Jardim dos Coimbras,0.019566124130814253,east,Largo de Santa Cruz 28,Braga,Portugal,4700-322,"Largo de Santa Cruz 28, Braga 4700-322 Portugal",,
3869808,Indigo Centro de Estetica e Spa Urbano,0.23311627159256745,southeast,Rua Pedro Alvares Cabral 30,Coimbra,Portugal,3030-069,"Rua Pedro Alvares Cabral 30, Coimbra 3030-069 Portugal",,
,,,,,,,,,,
13238719,Mondrian Lounge Bar,0.024244515237478753,southwest,Largo do Rossio 56,Aveiro,Portugal,3830-755,"Largo do Rossio 56 Praia da Barra, Aveiro 3830-755 Portugal",Praia da Barra,
23654441,Glam Caffe,0.6298515087080829,west,Rua Americo Diniz 111 Casas Novas,Coimbra,Portugal,3045-138,"Rua Americo Diniz 111 Casas Novas, Coimbra 3045-138 Portugal",,
7391516,Patio da Inquisicao,0.008811321869438357,south,Rua Pedro Rocha,Coimbra,Portugal,3000-330,"Rua Pedro Rocha, Coimbra 3000-330 Portugal",,
14891851,Praca Humberto Delgado,0.7185229751119049,north,Praca Humberto Delgado,Aveiro,Portugal,3810-270,"Praca Humberto Delgado, Aveiro 3810-270 Portugal",,
7140301,Museum of Sacred Art of the Cathedral of Evora,0.023704272372104124,southwest,,Evora,Portugal,7000-809,"Marquês de Marialva broad, Evora 7000-809 Portugal",Marquês de Marialva broad,
3189278,O Pioneiro do Mondego,0.530773921503577,west,,Coimbra,Portugal,,Coimbra Portugal,,
23285801,Loyal Collect a Car,0.2690348152454364,northwest,Rua Chafariz Del Rei N33,Evora,Portugal,7005-323,"Rua Chafariz Del Rei N33, Evora 7005-323 Portugal",,
13551608,"Casa Nobre na Travessa do Cordovil, n.0 17",0.008797282704619451,west,Travessa do Cordovil 17,Evora,Portugal,7000-956,"Travessa do Cordovil 17, Evora 7000-956 Portugal",,
4101142,Eco Trilha,0.5212737596047626,east,,Braga,Portugal,4700-437,Braga 4700-437 Portugal,,
25268857,Purity Urban Spa,0.03424856699079014,northeast,Rua Nova do Casal dos Vagares 34,Coimbra,Portugal,3030-141,"Rua Nova do Casal dos Vagares 34 Lote 1 - R/ch, Coimbra 3030-141 Portugal",Lote 1 - R/ch,
7962739,Brios'Arte - Gourmet & Crafts,0.11732074028868696,south,Rua Edmundo Bettencourt 13,Coimbra,Portugal,3000-606,"Rua Edmundo Bettencourt 13 Quinta de São Jerónimo, Coimbra 3000-606 Portugal",Quinta de São Jerónimo,
15038183,Feijao Verde Fun Park,0.9064191817616507,north,Rua Manuel Madeira n0 9,Coimbra,Portugal,3025-999,"Rua Manuel Madeira n0 9, Coimbra 3025-999 Portugal",,
8533184,E.tour Bike Rental,0.4675798264422364,west,Coimbra Inovacao Parque,Coimbra,Portugal,3045-600,"Coimbra Inovacao Parque, Coimbra 3045-600 Portugal",,
7142467,Oficina da Formiga Ceramica,0.7157079122073393,southwest,Rua da Coutada 77,Ilhavo,Portugal,3830-134,"Rua da Coutada 77, Ilhavo 3830-134 Portugal",,
25166242,Galeria Albuquerque E Lima,0.6016702260863522,west,Rua Egas Moniz,Coimbra,Portugal,,"Rua Egas Moniz Lote 14 - Loja 5, Coimbra Portugal",Lote 14 - Loja 5,
15607032,Cais da Ribeira de Esgueira,0.37542362119746286,north,Rua de Santa Luzia 55,Aveiro,Portugal,3800-336,"Rua de Santa Luzia 55, Aveiro 3800-336 Portugal",,
10200835,Balneario Pre-Romano de Bracara,0.12550853160419737,northeast,Rua Nova da Estacao,Braga,Portugal,4700-223,"Rua Nova da Estacao, Braga 4700-223 Portugal",,
4082004,Forum Coimbra,0.7123610547080524,east,Avenida Jose Bonifacio de Andrade e Silva 1,Coimbra,Portugal,3040-389,"Avenida Jose Bonifacio de Andrade e Silva 1 Quinta do Vale Gemil – Almegue Santa Clara, Coimbra 3040-389 Portugal",Quinta do Vale Gemil – Almegue Santa Clara,
4101142,Eco Trilha,0.566399236173008,east,,Braga,Portugal,4700-437,Braga 4700-437 Portugal,,
7902576,Coimbra Secrets Escape Game,0.02194927731678526,northeast,Largo da Portagem 18,Coimbra,Portugal,3000-337,"Largo da Portagem 18, Coimbra 3000-337 Portugal",,
13564666,Jardim do Bacalhau,0.031710082967516214,south,R. de Mendo Estevens,Evora,Portugal,7000-864,"R. de Mendo Estevens, Evora 7000-864 Portugal",,
21327462,Espirito de Liberdade,0.4605864098765436,east,Rua Nova do Sobreiro,Coimbra,Portugal,3030-078,"Rua Nova do Sobreiro, Coimbra 3030-078 Portugal",,
7139660,Convent of Santa Clara (Evora),0.07827365598572669,south,Rua de Serpa Pinto,Evora,Portugal,7000-537,"Rua de Serpa Pinto Santo Antão, Evora 7000-537 Portugal",Santo Antão,
24898818,Capela De Sao Joao Da Ponte,0.5570850323046704,north,Largo Sao Joao Da Ponte - Sao Jose De Sao Lazaro,Braga,Portugal,4715-049,"Largo Sao Joao Da Ponte - Sao Jose De Sao Lazaro, Braga 4715-049 Portugal",,
7142467,Oficina da Formiga Ceramica,0.508209025533933,southwest,Rua da Coutada 77,Ilhavo,Portugal,3830-134,"Rua da Coutada 77, Ilhavo 3830-134 Portugal",,
4037743,Sete Fontes,0.4493077215484995,north,Lugar das Sete Fontes,Braga,Portugal,4715-165,"Lugar das Sete Fontes Sao Victor, Braga 4715-165 Portugal",Sao Victor,
12295163,Zero Emissions Tours,0.3514441783170752,south,,Coimbra,Portugal,,Coimbra Portugal,,
16648757,VR Lounge,0.38120097328763486,south,Rua Doutor Mario Sacramento N0 26,Aveiro,Portugal,3810-102,"Rua Doutor Mario Sacramento N0 26 Colombo II Building, Aveiro 3810-102 Portugal",Colombo II Building,
2294721,Museu D. Diogo de Sousa - Museum of Archeology,0.4775036093207093,north,Rua dos Bombeiros Voluntarios,Braga,Portugal,4700-025,"Rua dos Bombeiros Voluntarios, Braga 4700-025 Portugal",,
13568664,Edificio da Travessa dos Lagares,0.43225397514638453,east,Travessa dos Lagares 18,Evora,Portugal,7000-565,"Travessa dos Lagares 18, Evora 7000-565 Portugal",,
9766480,Minho Center,0.5382193671381763,north,Av. Robert Smith,Braga,Portugal,4700,"Av. Robert Smith Fraião, Braga 4700 Portugal",Fraião,
4107667,Mata Nacional de Vale de Canas,0.2407017323221021,west,Rua de Vale de Canas,Coimbra,Portugal,3030-277,"Rua de Vale de Canas, Coimbra 3030-277 Portugal",,
24898794,Escadorio Do Santuario Do Sameiro,1.3260893101540294,southwest,Avenida Nossa Senhora do Sameiro,Braga,Portugal,4715-616,"Avenida Nossa Senhora do Sameiro, Braga 4715-616 Portugal",,
17568170,Geres Adventure,0.8848853834895044,southwest,Avenida das Pontes N 446,Rio Caldo,Portugal,4845-024,"Avenida das Pontes N 446, Rio Caldo 4845-024 Portugal",,
16359889,Capela de Nossa Senhora de Guadalupe,0.09393591227268863,west,Rua da Regueira,Braga,Portugal,4710-304,"Rua da Regueira, Braga 4710-304 Portugal",,
19701352,Parque Desportivo da Rodovia,0.6215929585609462,west,Avenida Joao Paulo II,Braga,Portugal,4715-615,"Avenida Joao Paulo II, Braga 4715-615 Portugal",,
23545742,Picapeixe,0.7907409921727301,east,Cais da Ribeira da Aldeia,Aveiro,Portugal,3860-544,"Cais da Ribeira da Aldeia, Aveiro 3860-544 Portugal",,
13630920,Mouraria de Evora,0.05551513927542986,northeast,Rua da Mouraria,Evora,Portugal,7004-519,"Rua da Mouraria, Evora 7004-519 Portugal",,
13620273,Cruzeiro da Misericordia de Estremoz,0.08256821658051908,west,Rossio Marques de Pombal,Estremoz,Portugal,7100-020,"Rossio Marques de Pombal, Estremoz 7100-020 Portugal",,
13551548,Ecopista de Evora - Ramal de Mora,0.1631752638010721,southwest,Chafariz d'El Rei,Evora,Portugal,7005-323,"Chafariz d'El Rei, Evora 7005-323 Portugal",,
456686,Jardim da Quinta das Lagrimas,0.893321054280197,north,Rua Antonio Augusto Goncalves,Coimbra,Portugal,3040-999,"Rua Antonio Augusto Goncalves, Coimbra 3040-999 Portugal",,
23596323,Aveiro Spa,0.18295173740423792,southwest,"Rua Jose Afonso, N34 Parque Do Cais Da Fonte Nova",Aveiro,Portugal,,"Rua Jose Afonso, N34 Parque Do Cais Da Fonte Nova, Aveiro Portugal",,
8761597,Bowling House Fun & Coffee,0.30016570628060474,west,Rua do Feital,Braga,Portugal,4700-154,"Rua do Feital Lote 37, 38A, Braga 4700-154 Portugal","Lote 37, 38A",
23988378,Ciclo De Concertos De Coimbra,0.12406785330587221,northeast,"Rua Dom Francisco De Almeida, 14",Coimbra,Portugal,3030-382,"Rua Dom Francisco De Almeida, 14 Culturxis: Cáritas Diocesana De Coimbra, Coimbra 3030-382 Portugal",Culturxis: Cáritas Diocesana De Coimbra,
13620292,Convento dos Congregados,0.19216211941209546,west,Rossio Marques de Pombal,Estremoz,Portugal,7100-020,"Rossio Marques de Pombal, Estremoz 7100-020 Portugal",,
23654441,Glam Caffe,0.5581914045814232,southwest,Rua Americo Diniz 111 Casas Novas,Coimbra,Portugal,3045-138,"Rua Americo Diniz 111 Casas Novas, Coimbra 3045-138 Portugal",,
19701352,Parque Desportivo da Rodovia,0.6742530267219545,southeast,Avenida Joao Paulo II,Braga,Portugal,4715-615,"Avenida Joao Paulo II, Braga 4715-615 Portugal",,
23484406,Statue of Reverend Father Jose Vieira Pereira,0.170730495237581,northeast,R. da Igreja Nova,Canical,Portugal,9200,"R. da Igreja Nova, Canical, Madeira 9200 Portugal",,Madeira
13498195,Clube Tenis Braga,0.8243072301065957,northwest,Rua Candido Oliveira 80,Braga,Portugal,,"Rua Candido Oliveira 80, Braga Portugal",,
23285801,Loyal Collect a Car,0.9474796630182432,west,Rua Chafariz Del Rei N33,Evora,Portugal,7005-323,"Rua Chafariz Del Rei N33, Evora 7005-323 Portugal",,
23947289,Magicplace Aveiro,0.49633156782310023,west,Rua General Jose Domingues Peres,Aveiro,Portugal,3800-404,"Rua General Jose Domingues Peres 36, Aveiro 3800-404 Portugal",36,
8761597,Bowling House Fun & Coffee,0.68430851824423,northeast,Rua do Feital,Braga,Portugal,4700-154,"Rua do Feital Lote 37, 38A, Braga 4700-154 Portugal","Lote 37, 38A",
13498195,Clube Tenis Braga,0.6967957682492848,west,Rua Candido Oliveira 80,Braga,Portugal,,"Rua Candido Oliveira 80, Braga Portugal",,
17487738,Igreja de Sao Salvador,0.023061539723266793,northeast,Largo de Sao Salvador 4,Coimbra,Portugal,3000-372,"Largo de Sao Salvador 4, Coimbra 3000-372 Portugal",,
23654441,Glam Caffe,1.1090283322051853,southwest,Rua Americo Diniz 111 Casas Novas,Coimbra,Portugal,3045-138,"Rua Americo Diniz 111 Casas Novas, Coimbra 3045-138 Portugal",,
21221304,Simaris,0.6659347507684444,northeast,Estrada de Taboeira,Aveiro,Portugal,3800-043,"Estrada de Taboeira, Aveiro 3800-043 Portugal",,
12541203,Cais A Porta,0.04091180833526922,northeast,Cais das Falcoeiras 6,Aveiro,Portugal,3800-180,"Cais das Falcoeiras 6, Aveiro 3800-180 Portugal",,
10398805,Top Emotions,0.005877017065302777,southeast,Rua de Vasco da Gama 8,Evora,Portugal,7000-941,"Rua de Vasco da Gama 8, Evora 7000-941 Portugal",,
1962876,Turaventur Day Tours,0.248266486210247,east,Quinta do Serrado,Evora,Portugal,7000-173,"Quinta do Serrado Sr dos Aflitos, Evora 7000-173 Portugal",Sr dos Aflitos,
21246619,Atelier de Larim,0.07704380062651452,southeast,"Largo Comendador Joaquim Manuel de Faria, 12",Braga,Portugal,4730-577,"Largo Comendador Joaquim Manuel de Faria, 12, Braga 4730-577 Portugal",,
19240895,Picoto Adventure Park,0.46673192245549716,west,Rua Joao Evangelista Vieira,Braga,Portugal,4715-121,"Rua Joao Evangelista Vieira, Braga 4715-121 Portugal",,
15668831,Tricana de Coimbra,0.009120165801696096,northeast,R. de Quebra Costas 50-56,Coimbra,Portugal,3000-340,"R. de Quebra Costas 50-56, Coimbra 3000-340 Portugal",,
14203504,Alecrim Spa,0.26462354910865216,south,Rua Abade Loureira n0 49,Braga,Portugal,4700-356,"Rua Abade Loureira n0 49, Braga 4700-356 Portugal",,
4011089,Hugo Crespo - Servicos Equestres,0.6005689465171458,south,Quinta do Frade,Coimbra,Portugal,6300-080,"Quinta do Frade, Coimbra 6300-080 Portugal",,
,,,,,,,,,,
12928798,Vipbus,0.34882215454394516,west,,Coimbra,Portugal,,Coimbra Portugal,,
3513912,Cattedrale di Aveiro,0.06985837885210083,east,"Rua Batalhao Cacadores Dez, 67",Aveiro,Portugal,3810-064,"Rua Batalhao Cacadores Dez, 67, Aveiro 3810-064 Portugal",,
11629534,Solve & Escape,0.609442592744794,west,Rua Magalhaes Serrao 1,Aveiro,Portugal,3810-130,"Rua Magalhaes Serrao 1, Aveiro 3810-130 Portugal",,
23484406,Statue of Reverend Father Jose Vieira Pereira,0.1347308607458595,southeast,R. da Igreja Nova,Canical,Portugal,9200,"R. da Igreja Nova, Canical, Madeira 9200 Portugal",,Madeira
12928798,Vipbus,0.2944964719054498,southwest,,Coimbra,Portugal,,Coimbra Portugal,,
13873545,Alentejo In Ride,0.09071768417953498,east,"Rua do Escoural, 38",Evora,Portugal,7005-426,"Rua do Escoural, 38 Bº Sra da Saude, Evora 7005-426 Portugal",Bº Sra da Saude,
3869808,Indigo Centro de Estetica e Spa Urbano,0.09969309824966496,southeast,Rua Pedro Alvares Cabral 30,Coimbra,Portugal,3030-069,"Rua Pedro Alvares Cabral 30, Coimbra 3030-069 Portugal",,
19261527,Escadas do Quinchorro,0.8593194102334965,east,R. dos Foscadores 9,Coimbra,Portugal,3040-202,"R. dos Foscadores 9, Coimbra 3040-202 Portugal",,
7789442,Museu PIO XII,0.3321274815313928,southeast,Largo de Sao Tiago 47,Braga,Portugal,4700-039,"Largo de Sao Tiago 47 Largo de Santiago, 47, Braga 4700-039 Portugal","Largo de Santiago, 47",
2294721,Museu D. Diogo de Sousa - Museum of Archeology,0.46701791611950416,north,Rua dos Bombeiros Voluntarios,Braga,Portugal,4700-025,"Rua dos Bombeiros Voluntarios, Braga 4700-025 Portugal",,
,,,,,,,,,,
13568664,Edificio da Travessa dos Lagares,0.9355576423729384,east,Travessa dos Lagares 18,Evora,Portugal,7000-565,"Travessa dos Lagares 18, Evora 7000-565 Portugal",,
3874056,Observatorio Geofisico e Astronomico,0.24353445004878216,northeast,Rua do Observatorio S/N,Coimbra,Portugal,3040-004,"Rua do Observatorio S/N, Coimbra 3040-004 Portugal",,
16843797,Fonte da Audicao,0.7055652284509418,southwest,Monte do Bom Jesus 4715-056,Braga,Portugal,4715-297,"Monte do Bom Jesus 4715-056, Braga 4715-297 Portugal",,
2543290,Aqueduto da Agua de Prata,0.08819523580258026,north,R. do Muro 8,Evora,Portugal,7000-602,"R. do Muro 8, Evora 7000-602 Portugal",,
15668949,Portal Manuelino,0.04993094174140418,southeast,R. Dr. Guilherme Moreira 10,Coimbra,Portugal,3000-210,"R. Dr. Guilherme Moreira 10, Coimbra 3000-210 Portugal",,
15668831,Tricana de Coimbra,0.37745643276086926,southeast,R. de Quebra Costas 50-56,Coimbra,Portugal,3000-340,"R. de Quebra Costas 50-56, Coimbra 3000-340 Portugal",,
7225933,Centro Historico de Evora,0.00643817359089052,north,,Evora,Portugal,7000,Evora 7000 Portugal,,
7140311,Chafariz das Bravas,0.1542689691992953,northwest,Avenida Tulio Espanca,Evora,Portugal,7000-768,"Avenida Tulio Espanca, Evora 7000-768 Portugal",,
15668873,Carmelo de Santa Teresa,0.10747974406550749,north,Rua Santa Teresa 16,Coimbra,Portugal,3000-359,"Rua Santa Teresa 16, Coimbra 3000-359 Portugal",,
8533184,E.tour Bike Rental,0.2999582339857889,northeast,Coimbra Inovacao Parque,Coimbra,Portugal,3045-600,"Coimbra Inovacao Parque, Coimbra 3045-600 Portugal",,
12541203,Cais A Porta,0.050671747568128166,north,Cais das Falcoeiras 6,Aveiro,Portugal,3800-180,"Cais das Falcoeiras 6, Aveiro 3800-180 Portugal",,
13630953,Santuario de Santa Maria Madalena da Falperra,0.905966477665296,southeast,N309,Braga,Portugal,,"N309, Braga Portugal",,
13124988,Just Be,0.7516473507221455,east,Avenida Sao Sebastiao 9,Evora,Portugal,7000-767,"Avenida Sao Sebastiao 9, Evora 7000-767 Portugal",,
6117134,Mercado Municipal D. Pedro V,0.16789761558138205,south,Rua Nicolau Rui Fernandes,Coimbra,Portugal,3000-303,"Rua Nicolau Rui Fernandes, Coimbra 3000-303 Portugal",,
25190380,Sensispa,0.835096807903935,northeast,Rua Padre Armando Lira,Braga,Portugal,4705-672,"Rua Padre Armando Lira 22, Braga 4705-672 Portugal",22,
7789442,Museu PIO XII,0.4382416950551455,south,Largo de Sao Tiago 47,Braga,Portugal,4700-039,"Largo de Sao Tiago 47 Largo de Santiago, 47, Braga 4700-039 Portugal","Largo de Santiago, 47",
4107667,Mata Nacional de Vale de Canas,0.6628059126424811,southwest,Rua de Vale de Canas,Coimbra,Portugal,3030-277,"Rua de Vale de Canas, Coimbra 3030-277 Portugal",,
23654441,Glam Caffe,0.9228057369581905,west,Rua Americo Diniz 111 Casas Novas,Coimbra,Portugal,3045-138,"Rua Americo Diniz 111 Casas Novas, Coimbra 3045-138 Portugal",,
13568587,Edificio da Rua Candido dos Reis,0.0347556634199343,northeast,Rua Candido dos Reis,Evora,Portugal,7000-582,"Rua Candido dos Reis 45 A, Evora 7000-582 Portugal",45 A,
3869808,Indigo Centro de Estetica e Spa Urbano,0.2195608858276086,east,Rua Pedro Alvares Cabral 30,Coimbra,Portugal,3030-069,"Rua Pedro Alvares Cabral 30, Coimbra 3030-069 Portugal",,
13587498,Anta da Herdade da Murteira,0.030937346451417398,east,,Evora,Portugal,7005-776,"Herdade da Murteira, Evora 7005-776 Portugal",Herdade da Murteira,
4011089,Hugo Crespo - Servicos Equestres,0.1618584662824128,north,Quinta do Frade,Coimbra,Portugal,6300-080,"Quinta do Frade, Coimbra 6300-080 Portugal",,
8533184,E.tour Bike Rental,0.10915974132299101,northeast,Coimbra Inovacao Parque,Coimbra,Portugal,3045-600,"Coimbra Inovacao Parque, Coimbra 3045-600 Portugal",,
9766480,Minho Center,0.6373850060728263,north,Av. Robert Smith,Braga,Portugal,4700,"Av. Robert Smith Fraião, Braga 4700 Portugal",Fraião,
12928798,Vipbus,0.31957563498409436,south,,Coimbra,Portugal,,Coimbra Portugal,,
10260667,Convento de Santo Antonio Church,0.4890305618384933,north,Largo de Santo Antonio,Aveiro,Portugal,3810-169,"Largo de Santo Antonio, Aveiro 3810-169 Portugal",,
23341679,Estacao Ferroviaria De Coimbra,0.7581024870886361,west,Largo das Ameias,Coimbra,Portugal,3000-024,"Largo das Ameias, Coimbra 3000-024 Portugal",,
23654441,Glam Caffe,0.7222409369539065,southwest,Rua Americo Diniz 111 Casas Novas,Coimbra,Portugal,3045-138,"Rua Americo Diniz 111 Casas Novas, Coimbra 3045-138 Portugal",,
14891851,Praca Humberto Delgado,0.0954992799358747,northwest,Praca Humberto Delgado,Aveiro,Portugal,3810-270,"Praca Humberto Delgado, Aveiro 3810-270 Portugal",,
7140311,Chafariz das Bravas,0.3488005242838868,northeast,Avenida Tulio Espanca,Evora,Portugal,7000-768,"Avenida Tulio Espanca, Evora 7000-768 Portugal",,
3292242,Choupal National Forest,0.7395127790356019,south,,Coimbra,Portugal,,Coimbra Portugal,,
23816917,Cinemas Zero Tabus Aveiro,0.08143507063780285,east,Rua Hintze Ribeiro 66,Aveiro,Portugal,3800-359,"Rua Hintze Ribeiro 66, Aveiro 3800-359 Portugal",,
13630870,Departamento de Arquitectura e Artes Visuais da UE,0.9250733925256236,south,N18 36,Evora,Portugal,7005-005,"N18 36, Evora 7005-005 Portugal",,
2543020,Portugal Kayak,0.1296181327603002,south,Douro River,Aveiro,Portugal,3800-098,"Douro River, Aveiro 3800-098 Portugal",,
7391516,Patio da Inquisicao,0.02842553740522348,west,Rua Pedro Rocha,Coimbra,Portugal,3000-330,"Rua Pedro Rocha, Coimbra 3000-330 Portugal",,
25270686,Supremus Crossbox,1.0305575077999498,east,R. de Caires N211,Braga,Portugal,4700-206,"R. de Caires N211, Braga 4700-206 Portugal",,
4037743,Sete Fontes,0.5746175233986915,east,Lugar das Sete Fontes,Braga,Portugal,4715-165,"Lugar das Sete Fontes Sao Victor, Braga 4715-165 Portugal",Sao Victor,
3874056,Observatorio Geofisico e Astronomico,0.4927619340769763,east,Rua do Observatorio S/N,Coimbra,Portugal,3040-004,"Rua do Observatorio S/N, Coimbra 3040-004 Portugal",,
13620292,Convento dos Congregados,0.37152790950071135,northwest,Rossio Marques de Pombal,Estremoz,Portugal,7100-020,"Rossio Marques de Pombal, Estremoz 7100-020 Portugal",,
10064420,Agitours,0.4071424309142549,south,Rua Luis de Camoes n064,Agueda,Portugal,3750-159,"Rua Luis de Camoes n064, Agueda 3750-159 Portugal",,
15606728,Museu de Ciencia da Universidade de Coimbra,0.09445078568751075,east,Largo Marques de Pombal,Coimbra,Portugal,3700-272,"Largo Marques de Pombal, Coimbra 3700-272 Portugal",,
6420077,Universidade de Coimbra Alta & Sofia,0.02979869488557763,east,Rua do Arco da Traicao,Coimbra,Portugal,3000-056,"Rua do Arco da Traicao, Coimbra 3000-056 Portugal",,
14059039,B de Brincar/ Ler Com Prazer,0.03262917230960981,south,Travessa de Lopo Serrao 16,Evora,Portugal,7000-629,"Travessa de Lopo Serrao 16, Evora 7000-629 Portugal",,
13273547,Bracara Wine,0.6812975190111763,north,Rua da Cruz de Pedra 96,Braga,Portugal,4700-219,"Rua da Cruz de Pedra 96 Centro Comercial Cruz de Pedra, Loja 50, Braga 4700-219 Portugal","Centro Comercial Cruz de Pedra, Loja 50",
17568170,Geres Adventure,0.7683087950605815,southwest,Avenida das Pontes N 446,Rio Caldo,Portugal,4845-024,"Avenida das Pontes N 446, Rio Caldo 4845-024 Portugal",,
,,,,,,,,,,
14891851,Praca Humberto Delgado,0.3484103345338578,east,Praca Humberto Delgado,Aveiro,Portugal,3810-270,"Praca Humberto Delgado, Aveiro 3810-270 Portugal",,
20207765,Coimbra' Singular,0.5020573613914463,north,Rua Alto da Mainca,Coimbra,Portugal,3020-255,"Rua Alto da Mainca 75, Coimbra 3020-255 Portugal",75,
3292245,Water Museum,0.29859186518296826,west,Parque Dr. Manuel Braga,Coimbra,Portugal,3040-202,"Parque Dr. Manuel Braga, Coimbra 3040-202 Portugal",,
4107667,Mata Nacional de Vale de Canas,0.713831869243351,southwest,Rua de Vale de Canas,Coimbra,Portugal,3030-277,"Rua de Vale de Canas, Coimbra 3030-277 Portugal",,
4011089,Hugo Crespo - Servicos Equestres,0.7707545290522462,southwest,Quinta do Frade,Coimbra,Portugal,6300-080,"Quinta do Frade, Coimbra 6300-080 Portugal",,
,,,,,,,,,,
21221304,Simaris,0.6481903973934597,north,Estrada de Taboeira,Aveiro,Portugal,3800-043,"Estrada de Taboeira, Aveiro 3800-043 Portugal",,
23596323,Aveiro Spa,0.20613005704858925,southwest,"Rua Jose Afonso, N34 Parque Do Cais Da Fonte Nova",Aveiro,Portugal,,"Rua Jose Afonso, N34 Parque Do Cais Da Fonte Nova, Aveiro Portugal",,
3189278,O Pioneiro do Mondego,0.630042358211064,west,,Coimbra,Portugal,,Coimbra Portugal,,
17452360,Breakout Braga Escape Game,0.062426234343277334,east,"Rua de Santo Andre, 30",Braga,Portugal,4710-308,"Rua de Santo Andre, 30 Store 220 - Bragashopping, Braga 4710-308 Portugal",Store 220 - Bragashopping,
23654441,Glam Caffe,0.799087127838693,west,Rua Americo Diniz 111 Casas Novas,Coimbra,Portugal,3045-138,"Rua Americo Diniz 111 Casas Novas, Coimbra 3045-138 Portugal",,
7142467,Oficina da Formiga Ceramica,1.0680878201102015,northwest,Rua da Coutada 77,Ilhavo,Portugal,3830-134,"Rua da Coutada 77, Ilhavo 3830-134 Portugal",,
13620292,Convento dos Congregados,0.46976679596114823,south,Rossio Marques de Pombal,Estremoz,Portugal,7100-020,"Rossio Marques de Pombal, Estremoz 7100-020 Portugal",,
23988378,Ciclo De Concertos De Coimbra,0.07898192588296721,southeast,"Rua Dom Francisco De Almeida, 14",Coimbra,Portugal,3030-382,"Rua Dom Francisco De Almeida, 14 Culturxis: Cáritas Diocesana De Coimbra, Coimbra 3030-382 Portugal",Culturxis: Cáritas Diocesana De Coimbra,
10091681,By Heart,0.15778939799139696,south,Rua de Sao Vicente 55,Braga,Portugal,4710-312,"Rua de Sao Vicente 55, Braga 4710-312 Portugal",,
23508371,Percursos Do Centro,1.0076080371004423,west,Av. Fernando Namora,Coimbra,Portugal,,"Av. Fernando Namora, Coimbra Portugal",,
12541203,Cais A Porta,0.016520789013570653,north,Cais das Falcoeiras 6,Aveiro,Portugal,3800-180,"Cais das Falcoeiras 6, Aveiro 3800-180 Portugal",,
15238097,Skydive Porto,0.6406962128049881,north,"Rua do Carregal, 62",Braga,Portugal,4700-154,"Rua do Carregal, 62 Palmeira, Braga 4700-154 Portugal",Palmeira,
23341679,Estacao Ferroviaria De Coimbra,0.9656840253078304,northwest,Largo das Ameias,Coimbra,Portugal,3000-024,"Largo das Ameias, Coimbra 3000-024 Portugal",,
13273547,Bracara Wine,0.2871034911842608,north,Rua da Cruz de Pedra 96,Braga,Portugal,4700-219,"Rua da Cruz de Pedra 96 Centro Comercial Cruz de Pedra, Loja 50, Braga 4700-219 Portugal","Centro Comercial Cruz de Pedra, Loja 50",
7140311,Chafariz das Bravas,0.19415890839149674,east,Avenida Tulio Espanca,Evora,Portugal,7000-768,"Avenida Tulio Espanca, Evora 7000-768 Portugal",,
3874056,Observatorio Geofisico e Astronomico,0.723421484849483,northeast,Rua do Observatorio S/N,Coimbra,Portugal,3040-004,"Rua do Observatorio S/N, Coimbra 3040-004 Portugal",,
13551548,Ecopista de Evora - Ramal de Mora,0.4334559725135643,west,Chafariz d'El Rei,Evora,Portugal,7005-323,"Chafariz d'El Rei, Evora 7005-323 Portugal",,
456686,Jardim da Quinta das Lagrimas,0.5740502317519178,east,Rua Antonio Augusto Goncalves,Coimbra,Portugal,3040-999,"Rua Antonio Augusto Goncalves, Coimbra 3040-999 Portugal",,
9766480,Minho Center,0.4962148954620068,northwest,Av. Robert Smith,Braga,Portugal,4700,"Av. Robert Smith Fraião, Braga 4700 Portugal",Fraião,
8469801,Puzzle Room Evora,0.049763212898633585,southeast,Rua dos Caldeireiros 9A,Evora,Portugal,7000-529,"Rua dos Caldeireiros 9A, Evora 7000-529 Portugal",,
13620292,Convento dos Congregados,0.20761673699184494,southwest,Rossio Marques de Pombal,Estremoz,Portugal,7100-020,"Rossio Marques de Pombal, Estremoz 7100-020 Portugal",,
456686,Jardim da Quinta das Lagrimas,0.7768769552554733,east,Rua Antonio Augusto Goncalves,Coimbra,Portugal,3040-999,"Rua Antonio Augusto Goncalves, Coimbra 3040-999 Portugal",,
23341679,Estacao Ferroviaria De Coimbra,1.2105666502315644,northeast,Largo das Ameias,Coimbra,Portugal,3000-024,"Largo das Ameias, Coimbra 3000-024 Portugal",,
21221304,Simaris,0.2483814116085042,northeast,Estrada de Taboeira,Aveiro,Portugal,3800-043,"Estrada de Taboeira, Aveiro 3800-043 Portugal",,
13498195,Clube Tenis Braga,0.20230232762965872,southeast,Rua Candido Oliveira 80,Braga,Portugal,,"Rua Candido Oliveira 80, Braga Portugal",,
